{
  "printer": "POS-8730",
  "transport": {
    "protocol": "tcp",
    "defaultHostObserved": "192.168.1.100",
    "defaultPort": 9100,
    "senderObserved": "192.168.1.51",
    "payloadEncoding": "hex bytes separated by spaces"
  },
  "settings": [
    {
      "title": "Set Printing mode",
      "description": "Ustawienie trybu drukowania.",
      "options": [
        {
          "label": "Chinese",
          "commandHex": "1b 4e 03 01"
        },
        {
          "label": "ASCII",
          "commandHex": "1b 4e 03 00"
        }
      ]
    },
    {
      "title": "Cutting Setting",
      "description": "Wlaczenie lub wylaczenie automatycznego ciecia papieru.",
      "options": [
        {
          "label": "ON",
          "commandHex": "1f 1b 12 01"
        },
        {
          "label": "OFF",
          "commandHex": "1f 1b 12 00"
        }
      ]
    },
    {
      "title": "Set Density Level",
      "description": "Ustawienie poziomu intensywnosci druku.",
      "options": [
        {
          "label": "Level1_Light",
          "commandHex": "1b 4e 04 01"
        },
        {
          "label": "Level2_Light",
          "commandHex": "1b 4e 04 02"
        },
        {
          "label": "Level3_Dark",
          "commandHex": "1b 4e 04 03"
        },
        {
          "label": "Level4_Dark",
          "commandHex": "1b 4e 04 04"
        }
      ]
    },
    {
      "title": "Set Default Char",
      "description": "Ustawienie domyslnego rozmiaru znakow.",
      "options": [
        {
          "label": "ASCII:9x17",
          "commandHex": "1b 4e 13 00"
        },
        {
          "label": "ASCII:12x24",
          "commandHex": "1b 4e 13 01"
        },
        {
          "label": "ASCII:9x24",
          "commandHex": "1b 4e 13 02"
        }
      ]
    },
    {
      "title": "USB PID Set",
      "description": "Ustawienie identyfikatora USB Product ID.",
      "options": [
        {
          "label": "5011",
          "commandHex": "1f 1b 16 01 11 50"
        },
        {
          "label": "58Label",
          "commandHex": "1f 1b 16 01 43 57"
        },
        {
          "label": "58KRY",
          "commandHex": "1f 1b 16 01 00 02"
        },
        {
          "label": "OPOS",
          "commandHex": "1f 1b 16 01 20 57"
        },
        {
          "label": "80KRY",
          "commandHex": "1f 1b 16 01 1c 81"
        },
        {
          "label": "POS365",
          "commandHex": "1f 1b 16 01 1e 81"
        }
      ]
    },
    {
      "title": "Set Default Page",
      "description": "Ustawienie domyslnej strony kodowej.",
      "options": [
        {
          "label": "OEM437(Std.Europe)",
          "commandHex": "1f 1b 1f ff 00 0a"
        },
        {
          "label": "(Katakana)(1)",
          "commandHex": "1f 1b 1f ff 01 0a"
        },
        {
          "label": "OEM850(Multiling)",
          "commandHex": "1f 1b 1f ff 02 0a"
        },
        {
          "label": "OEM860(Portuguese)",
          "commandHex": "1f 1b 1f ff 03 0a"
        },
        {
          "label": "OEM863(Canadian)",
          "commandHex": "1f 1b 1f ff 04 0a"
        },
        {
          "label": "OEM865(Nordic)",
          "commandHex": "1f 1b 1f ff 05 0a"
        },
        {
          "label": "(West Europe)",
          "commandHex": "1f 1b 1f ff 06 0a"
        },
        {
          "label": "(Greek)",
          "commandHex": "1f 1b 1f ff 07 0a"
        },
        {
          "label": "(Hebrew)(1)",
          "commandHex": "1f 1b 1f ff 08 0a"
        },
        {
          "label": "(East Europe)",
          "commandHex": "1f 1b 1f ff 09 0a"
        },
        {
          "label": "(Iran)",
          "commandHex": "1f 1b 1f ff 0a 0a"
        },
        {
          "label": "WPC1252",
          "commandHex": "1f 1b 1f ff 10 0a"
        },
        {
          "label": "OEM866(Cyrillic#)",
          "commandHex": "1f 1b 1f ff 11 0a"
        },
        {
          "label": "OEM852(Latin2)",
          "commandHex": "1f 1b 1f ff 12 0a"
        },
        {
          "label": "OEM858",
          "commandHex": "1f 1b 1f ff 13 0a"
        },
        {
          "label": "(IranII)",
          "commandHex": "1f 1b 1f ff 14 0a"
        },
        {
          "label": "(Latvian)",
          "commandHex": "1f 1b 1f ff 15 0a"
        },
        {
          "label": "ISO-8859-6(Arabic)",
          "commandHex": "1f 1b 1f ff 16 0a"
        },
        {
          "label": "(PT151,1251)",
          "commandHex": "1f 1b 1f ff 17 0a"
        },
        {
          "label": "OEM747",
          "commandHex": "1f 1b 1f ff 18 0a"
        },
        {
          "label": "WPC1257",
          "commandHex": "1f 1b 1f ff 19 0a"
        },
        {
          "label": "(Vietnam)",
          "commandHex": "1f 1b 1f ff 1b 0a"
        },
        {
          "label": "OEM864",
          "commandHex": "1f 1b 1f ff 1c 0a"
        },
        {
          "label": "PC1001",
          "commandHex": "1f 1b 1f ff 1d 0a"
        },
        {
          "label": "(Uigur)",
          "commandHex": "1f 1b 1f ff 1e 0a"
        },
        {
          "label": "(Hebrew)(2)",
          "commandHex": "1f 1b 1f ff 1f 0a"
        },
        {
          "label": "WPC1255(Israel)",
          "commandHex": "1f 1b 1f ff 20 0a"
        },
        {
          "label": "OEM437(Std.Europe)",
          "commandHex": "1f 1b 1f ff 32 0a"
        },
        {
          "label": "(Katakana)(2)",
          "commandHex": "1f 1b 1f ff 33 0a"
        },
        {
          "label": "OEM437(Std.Europe)",
          "commandHex": "1f 1b 1f ff 34 0a"
        },
        {
          "label": "OEM858(Multiling)",
          "commandHex": "1f 1b 1f ff 35 0a"
        },
        {
          "label": "OEM852(Latin-2)",
          "commandHex": "1f 1b 1f ff 36 0a"
        },
        {
          "label": "OEM860(Portuguese)",
          "commandHex": "1f 1b 1f ff 37 0a"
        },
        {
          "label": "OEM861(Icelandic)",
          "commandHex": "1f 1b 1f ff 38 0a"
        },
        {
          "label": "OEM863(Canadian)",
          "commandHex": "1f 1b 1f ff 39 0a"
        },
        {
          "label": "OEM865(Nordic)",
          "commandHex": "1f 1b 1f ff 3a 0a"
        },
        {
          "label": "OEM866(Russian)",
          "commandHex": "1f 1b 1f ff 3b 0a"
        },
        {
          "label": "OEM855(Bulgarian)",
          "commandHex": "1f 1b 1f ff 3c 0a"
        },
        {
          "label": "OEM857(Turkey)",
          "commandHex": "1f 1b 1f ff 3d 0a"
        },
        {
          "label": "OEM862(Hebrew)",
          "commandHex": "1f 1b 1f ff 3e 0a"
        },
        {
          "label": "OEM864(Arabic)",
          "commandHex": "1f 1b 1f ff 3f 0a"
        },
        {
          "label": "OEM737(Greek)",
          "commandHex": "1f 1b 1f ff 40 0a"
        },
        {
          "label": "OEM851(Greek)",
          "commandHex": "1f 1b 1f ff 41 0a"
        },
        {
          "label": "OEM869(Greek)",
          "commandHex": "1f 1b 1f ff 42 0a"
        },
        {
          "label": "OEM928(Greek)",
          "commandHex": "1f 1b 1f ff 43 0a"
        },
        {
          "label": "OEM772(Lithuanian)",
          "commandHex": "1f 1b 1f ff 44 0a"
        },
        {
          "label": "OEM774(Lithuanian)",
          "commandHex": "1f 1b 1f ff 45 0a"
        },
        {
          "label": "OEM874(Thai)",
          "commandHex": "1f 1b 1f ff 46 0a"
        },
        {
          "label": "WPC1252(Latin-1)",
          "commandHex": "1f 1b 1f ff 47 0a"
        },
        {
          "label": "WPC1250(Latin-2)",
          "commandHex": "1f 1b 1f ff 48 0a"
        },
        {
          "label": "WPC1251(Cyrillic)",
          "commandHex": "1f 1b 1f ff 49 0a"
        },
        {
          "label": "PC3840(Russian)",
          "commandHex": "1f 1b 1f ff 4a 0a"
        },
        {
          "label": "PC3841(Gost)",
          "commandHex": "1f 1b 1f ff 4b 0a"
        },
        {
          "label": "PC3843(Polish)",
          "commandHex": "1f 1b 1f ff 4c 0a"
        },
        {
          "label": "PC3844(CS2)",
          "commandHex": "1f 1b 1f ff 4d 0a"
        },
        {
          "label": "PC3845(Hungarian)",
          "commandHex": "1f 1b 1f ff 4e 0a"
        },
        {
          "label": "PC3846(Turkish)",
          "commandHex": "1f 1b 1f ff 4f 0a"
        },
        {
          "label": "PC3847(Brazil-ABNT)",
          "commandHex": "1f 1b 1f ff 50 0a"
        },
        {
          "label": "PC3848(Brazil-ABICOMP)",
          "commandHex": "1f 1b 1f ff 51 0a"
        },
        {
          "label": "PC1001(Arabic)",
          "commandHex": "1f 1b 1f ff 52 0a"
        },
        {
          "label": "PC2001(Lithuanian)",
          "commandHex": "1f 1b 1f ff 53 0a"
        },
        {
          "label": "PC3001(Estonian)",
          "commandHex": "1f 1b 1f ff 54 0a"
        },
        {
          "label": "PC3002(Estonian)",
          "commandHex": "1f 1b 1f ff 55 0a"
        },
        {
          "label": "PC3011(Latvian)",
          "commandHex": "1f 1b 1f ff 56 0a"
        },
        {
          "label": "PC3012(Latvian)",
          "commandHex": "1f 1b 1f ff 57 0a"
        },
        {
          "label": "PC3021(Bulgarian)",
          "commandHex": "1f 1b 1f ff 58 0a"
        },
        {
          "label": "PC3041(Maltese)",
          "commandHex": "1f 1b 1f ff 59 0a"
        },
        {
          "label": "(Thai)",
          "commandHex": "1f 1b 1f ff ff 0a"
        },
        {
          "label": "WPC1253(Greek)",
          "commandHex": "1f 1b 1f ff 5a 0a"
        },
        {
          "label": "WPC1254(Turkish)",
          "commandHex": "1f 1b 1f ff 5b 0a"
        },
        {
          "label": "WPC1256(Arabic)",
          "commandHex": "1f 1b 1f ff 5c 0a"
        },
        {
          "label": "OEM720(Arabic)",
          "commandHex": "1f 1b 1f ff 5d 0a"
        },
        {
          "label": "WPC1258(Vietnam)",